{"schemaVersion":1,"count":1202,"targets":{"glossary-agrippe":{"title":"Agrippé","url":"glossaire.html?term=agrippe","category":"Glossaire"},"glossary-soutien":{"title":"Soutien","url":"glossaire.html?term=soutien","category":"Glossaire"},"rule-combat-2024-attaque":{"title":"Effectuer une attaque","url":"combat-2024.html#attaque","category":"Règle"},"glossary-attaque":{"title":"Attaque","url":"glossaire.html?term=attaque","category":"Glossaire"},"glossary-esquive":{"title":"Esquive","url":"glossaire.html?term=esquive","category":"Glossaire"},"glossary-etude":{"title":"Étude","url":"glossaire.html?term=etude","category":"Glossaire"},"glossary-pointe":{"title":"Pointe","url":"glossaire.html?term=pointe","category":"Glossaire"},"glossary-influence":{"title":"Influence","url":"glossaire.html?term=influence","category":"Glossaire"},"glossary-magie":{"title":"Magie","url":"glossaire.html?term=magie","category":"Glossaire"},"glossary-observation":{"title":"Observation","url":"glossaire.html?term=observation","category":"Glossaire"},"glossary-furtivite":{"title":"Furtivité","url":"glossaire.html?term=furtivite","category":"Glossaire"},"glossary-desengagement":{"title":"Désengagement","url":"glossaire.html?term=desengagement","category":"Glossaire"},"glossary-intention":{"title":"Intention","url":"glossaire.html?term=intention","category":"Glossaire"},"rule-combat-2024-opv":{"title":"Tomber à 0 point de vie","url":"combat-2024.html#opv","category":"Règle"},"glossary-stabilise":{"title":"Stabilisé","url":"glossaire.html?term=stabilise","category":"Glossaire"},"glossary-utilisation":{"title":"Utilisation","url":"glossaire.html?term=utilisation","category":"Glossaire"},"feat-faconneur":{"title":"Façonneur","url":"dons.html?q=Fa%C3%A7onneur","category":"Don"},"feat-musicien":{"title":"Musicien","url":"dons.html?q=Musicien","category":"Don"},"feat-doue":{"title":"Doué","url":"dons.html?q=Dou%C3%A9","category":"Don"},"feat-vigilant":{"title":"Vigilant","url":"dons.html?q=Vigilant","category":"Don"},"feat-guerisseur":{"title":"Guérisseur","url":"dons.html?q=Gu%C3%A9risseur","category":"Don"},"feat-robuste":{"title":"Robuste","url":"dons.html?q=Robuste","category":"Don"},"feat-chanceux":{"title":"Chanceux","url":"dons.html?q=Chanceux","category":"Don"},"feat-bagarreur-de-tavernes":{"title":"Bagarreur de tavernes","url":"dons.html?q=Bagarreur%20de%20tavernes","category":"Don"},"feat-sauvagerie-martiale":{"title":"Sauvagerie martiale","url":"dons.html?q=Sauvagerie%20martiale","category":"Don"},"magic-item-potion-de-guerison":{"title":"Potion de guérison","url":"objets-magiques.html?q=Potion%20de%20gu%C3%A9rison","category":"Objet magique"},"action-utiliser":{"title":"Utiliser","url":"quickref.html?q=Utiliser","category":"Action"},"page-sorts":{"title":"Sorts","url":"spells.html","category":"Sort"},"page-equipement":{"title":"Équipement","url":"armes-armures.html","category":"Objet"},"movement-se-relever":{"title":"Se relever","url":"quickref.html?q=Se%20relever","category":"Mouvement"},"page-glossaire":{"title":"Glossaire","url":"glossaire.html","category":"Glossaire"},"movement-deplacement-en-prise":{"title":"Déplacement en prise","url":"quickref.html?q=D%C3%A9placement%20en%20prise","category":"Mouvement"},"action-s-echapper":{"title":"S'échapper","url":"quickref.html?q=S'%C3%A9chapper","category":"Action"},"page-maitrises-d-armes":{"title":"Maîtrises d’armes","url":"mastery-2024.html","category":"Règle"},"page-historiques":{"title":"Historiques","url":"historique.html","category":"Historique"},"action-agripper":{"title":"Agripper","url":"quickref.html?q=Agripper","category":"Action"},"action-attaquer":{"title":"Attaquer","url":"quickref.html?q=Attaquer","category":"Action"},"reaction-attaque-d-opportunite":{"title":"Attaque d'opportunité","url":"quickref.html?q=Attaque%20d'opportunit%C3%A9","category":"Réaction"},"rule-rules-2024-attaque":{"title":"Jets d'attaque","url":"rules-2024.html#attaque","category":"Règle"},"action-se-desengager":{"title":"Se désengager","url":"quickref.html?q=Se%20d%C3%A9sengager","category":"Action"},"action-esquiver":{"title":"Esquiver","url":"quickref.html?q=Esquiver","category":"Action"},"action-etudier":{"title":"Étudier","url":"quickref.html?q=%C3%89tudier","category":"Action"},"action-se-cacher":{"title":"Se cacher","url":"quickref.html?q=Se%20cacher","category":"Action"},"action-influencer":{"title":"Influencer","url":"quickref.html?q=Influencer","category":"Action"},"action-se-preparer":{"title":"Se préparer","url":"quickref.html?q=Se%20pr%C3%A9parer","category":"Action"},"action-lancer-un-sort":{"title":"Lancer un sort","url":"quickref.html?q=Lancer%20un%20sort","category":"Action"},"action-rechercher":{"title":"Rechercher","url":"quickref.html?q=Rechercher","category":"Action"},"action-foncer":{"title":"Foncer","url":"quickref.html?q=Foncer","category":"Action"},"rule-combat-2024-pv":{"title":"Points de vie","url":"combat-2024.html#pv","category":"Règle"},"rule-combat-2024-temp":{"title":"Points de vie temporaires","url":"combat-2024.html#temp","category":"Règle"},"action-aider":{"title":"Aider","url":"quickref.html?q=Aider","category":"Action"},"rule-combat-2024-stabiliser-un-personnage":{"title":"Stabiliser un personnage","url":"combat-2024.html#stabiliser-un-personnage","category":"Règle"},"action-stabiliser-une-creature":{"title":"Stabiliser une créature","url":"quickref.html?q=Stabiliser%20une%20cr%C3%A9ature","category":"Action"},"movement-nager":{"title":"Nager","url":"quickref.html?q=Nager","category":"Mouvement"},"movement-voler":{"title":"Voler","url":"quickref.html?q=Voler","category":"Mouvement"},"lore-tiamat":{"title":"Tiamat","url":"divinites.html#tiamat","category":"Lore"},"lore-first-world":{"title":"First World","url":"plans-existence.html#first-world","category":"Lore"},"lore-mordenkainen":{"title":"Mordenkainen","url":"personnages-royaumes.html#mordenkainen","category":"Lore"},"lore-menzoberranzan":{"title":"Menzoberranzan","url":"faerun.html#menzoberranzan","category":"Lore"},"lore-companions-of-the-hall":{"title":"Companions of the Hall","url":"lore.html?term=companions-of-the-hall","category":"Lore"},"lore-otiluke":{"title":"Otiluke","url":"personnages-royaumes.html#otiluke","category":"Lore"},"lore-otto":{"title":"Otto","url":"personnages-royaumes.html#otto","category":"Lore"},"lore-jallarzi-sallavarian":{"title":"Jallarzi Sallavarian","url":"personnages-royaumes.html#jallarzi","category":"Lore"},"lore-zagyg":{"title":"Zagyg","url":"lore.html?term=zagyg","category":"Lore"},"lore-iuz":{"title":"Iuz","url":"lore.html?term=iuz","category":"Lore"},"lore-keraptis":{"title":"Keraptis","url":"lore.html?term=keraptis","category":"Lore"},"lore-acererak":{"title":"Acererak","url":"lore.html?term=acererak","category":"Lore"},"lore-queen-of-air-and-darkness":{"title":"Queen of Air and Darkness","url":"plans-existence.html#queen-of-air-and-darkness","category":"Lore"},"lore-barovia":{"title":"Barovia","url":"plans-existence.html#domaines-effroi","category":"Lore"},"lore-castle-ravenloft":{"title":"Castle Ravenloft","url":"plans-existence.html#castle-ravenloft","category":"Lore"},"lore-rudolph-van-richten":{"title":"Rudolph van Richten","url":"plans-existence.html#rudolph-van-richten","category":"Lore"},"lore-prince-of-frost":{"title":"Prince of Frost","url":"plans-existence.html#prince-of-frost","category":"Lore"},"lore-baba-yaga":{"title":"Baba Yaga","url":"personnages-royaumes.html#tasha","category":"Lore"},"lore-iggwilv":{"title":"Iggwilv","url":"personnages-royaumes.html#tasha","category":"Lore"},"lore-kas-the-betrayer":{"title":"Kas the Betrayer","url":"personnages-royaumes.html#kas","category":"Lore"},"lore-laeral-silverhand":{"title":"Laeral Silverhand","url":"personnages-royaumes.html#laeral","category":"Lore"},"lore-vajra-safahr":{"title":"Vajra Safahr","url":"personnages-royaumes.html#vajra","category":"Lore"},"lore-xanathar":{"title":"Xanathar","url":"personnages-royaumes.html#xanathar","category":"Lore"},"lore-undermountain":{"title":"Undermountain","url":"faerun.html#undermountain","category":"Lore"},"lore-yawning-portal":{"title":"Yawning Portal","url":"faerun.html#yawning-portal","category":"Lore"},"glossary-vitesse-de-nage":{"title":"Vitesse de nage","url":"glossaire.html?term=vitesse-de-nage","category":"Glossaire"},"glossary-vitesse-de-vol":{"title":"Vitesse de vol","url":"glossaire.html?term=vitesse-de-vol","category":"Glossaire"},"page-creation-de-personnage":{"title":"Création de personnage","url":"creation-personnage-2024.html","category":"Page"},"page-reference-rapide":{"title":"Référence rapide","url":"quickref.html","category":"Règle"},"page-dons":{"title":"Dons","url":"dons.html","category":"Don"},"page-combat":{"title":"Combat","url":"combat-2024.html","category":"Règle"},"page-classes":{"title":"Classes","url":"classes/index.html","category":"Classe"},"glossary-attaques-d-opportunite":{"title":"Attaques d'Opportunité","url":"glossaire.html?term=attaques-d-opportunite","category":"Glossaire"},"glossary-points-de-vie":{"title":"Points de vie","url":"glossaire.html?term=points-de-vie","category":"Glossaire"},"glossary-points-de-vie-temporaires":{"title":"Points de vie temporaires","url":"glossaire.html?term=points-de-vie-temporaires","category":"Glossaire"},"glossary-classe-d-armure":{"title":"Classe d'armure","url":"glossaire.html?term=classe-d-armure","category":"Glossaire"},"class-barde":{"title":"Barde","url":"classes/class-bard.html","category":"Classe"},"class-druide":{"title":"Druide","url":"classes/class-druid.html","category":"Classe"},"class-ensorceleur":{"title":"Ensorceleur","url":"classes/class-sorcerer.html","category":"Classe"},"class-magicien":{"title":"Magicien","url":"classes/class-wizard.html","category":"Classe"},"class-clerc":{"title":"Clerc","url":"classes/class-cleric.html","category":"Classe"},"class-paladin":{"title":"Paladin","url":"classes/class-paladin.html","category":"Classe"},"class-rodeur":{"title":"Rôdeur","url":"classes/